{
  "$schema": "../schema/local-finance-mart.schema.json",
  "id": "local-finance-mart-sample-2023-2025",
  "title": "Local finance mart sample, 2023-2025",
  "publisher": "transparenta.eu",
  "periodStart": "2023",
  "periodEnd": "2025",
  "currency": "RON",
  "retrievedDate": "2026-09-08",
  "provenance": {
    "source": "transparenta-eu-graphql",
    "locator": "https://api.transparenta.eu/graphql, aggregatedLineItems, account_category vn/ch, expense_types dezvoltare for development spending, report_type PRINCIPAL_AGGREGATED, years 2023-2025, per uat_ids",
    "confidence": "derived",
    "note": "Revenue, spending and development spending are summed from Transparenta line items. Own revenue, personnel and capital spending are derived from published classification-code prefixes."
  },
  "sourceHashes": {
    "transparentaResponsesSha256": "0079a76a1cf9b12bc7743c5d443bb8e5e5c5fdc275836b69dacfa7497d06314b",
    "uatRegistrySha256": "41e4dc48c0f5d8b03423dd8cc8789af6a0ec69538a68ab974ec5310d6ec49c02"
  },
  "registry": {
    "id": "uat-registry-2026",
    "period": "2026"
  },
  "assumptions": {
    "reportType": "PRINCIPAL_AGGREGATED",
    "transferPrefixes": [
      "04.",
      "11.",
      "42.",
      "43.",
      "44.",
      "45.",
      "46.",
      "48."
    ],
    "personnelEconomicPrefixes": [
      "10"
    ],
    "capitalEconomicPrefixes": [
      "70",
      "71",
      "72"
    ],
    "developmentExpenseType": "dezvoltare",
    "suspectMultipleOfMedian": 20
  },
  "sample": [
    {
      "siruta": "1017",
      "role": "county-seat"
    },
    {
      "siruta": "2309",
      "role": "rural-commune"
    },
    {
      "siruta": "1071",
      "role": "rural-commune"
    },
    {
      "siruta": "100004",
      "role": "rural-commune"
    },
    {
      "siruta": "97090",
      "role": "rural-commune"
    },
    {
      "siruta": "96478",
      "role": "rural-commune"
    },
    {
      "siruta": "127144",
      "role": "rural-commune"
    },
    {
      "siruta": "128711",
      "role": "town"
    },
    {
      "siruta": "146904",
      "role": "rural-commune"
    },
    {
      "siruta": "179150",
      "role": "bucharest-sector"
    }
  ],
  "summary": {
    "uats": 10,
    "years": 3,
    "records": 30,
    "registryMatchedUats": 10,
    "rowsWithPopulation": 30,
    "revenueRon": 10558320726.44,
    "ownRevenueRon": 2664506335.72,
    "spendingRon": 45192900890.0,
    "personnelSpendingRon": 13355945476.38,
    "capitalSpendingRon": 1701964857.99,
    "developmentSpendingRon": 1895076637.86,
    "byYear": [
      {
        "year": 2023,
        "records": 10,
        "revenueRon": 3304001395.42,
        "ownRevenueRon": 859152926.4,
        "spendingRon": 14861322939.22,
        "personnelSpendingRon": 4148335252.57,
        "capitalSpendingRon": 527405228.75,
        "developmentSpendingRon": 0
      },
      {
        "year": 2024,
        "records": 10,
        "revenueRon": 3554011240.91,
        "ownRevenueRon": 866014631.47,
        "spendingRon": 15627561283.44,
        "personnelSpendingRon": 5133290821.42,
        "capitalSpendingRon": 567071642.56,
        "developmentSpendingRon": 997842044.39
      },
      {
        "year": 2025,
        "records": 10,
        "revenueRon": 3700308090.11,
        "ownRevenueRon": 939338777.85,
        "spendingRon": 14704016667.34,
        "personnelSpendingRon": 4074319402.39,
        "capitalSpendingRon": 607487986.68,
        "developmentSpendingRon": 897234593.47
      }
    ]
  },
  "records": [
    {
      "year": 2023,
      "siruta": "1017",
      "cui": "4562923",
      "level": "municipality",
      "sampleRole": "county-seat",
      "name": "MUNICIPIUL ALBA IULIA",
      "transparentaName": "MUNICIPIUL ALBA IULIA",
      "countyCode": "AB",
      "population": 74448,
      "populationSource": "ins-tempo-pop107d-locality",
      "revenueRon": 518066964.4,
      "ownRevenueRon": 82398824.18,
      "transferRevenueRon": 435668140.22,
      "spendingRon": 516612270.99,
      "personnelSpendingRon": 73213566.95,
      "capitalSpendingRon": 19941975.26,
      "developmentSpendingRon": 0,
      "arrearsRon": null,
      "ownRevenueShare": 0.1591,
      "personnelSpendingShare": 0.1417,
      "capitalSpendingShare": 0.0386,
      "developmentSpendingShare": 0.0,
      "revenuePerInhabitantRon": 6958.78,
      "ownRevenuePerInhabitantRon": 1106.8,
      "spendingPerInhabitantRon": 6939.24,
      "sourceLineCounts": {
        "revenue": 69,
        "spending": 552,
        "development": 0
      }
    },
    {
      "year": 2023,
      "siruta": "1071",
      "cui": "4562516",
      "level": "commune",
      "sampleRole": "rural-commune",
      "name": "CIUGUD",
      "transparentaName": "COMUNA CIUGUD",
      "countyCode": "AB",
      "population": 3307,
      "populationSource": "ins-tempo-pop107d-locality",
      "revenueRon": 17140071.25,
      "ownRevenueRon": 5042868.97,
      "transferRevenueRon": 12097202.28,
      "spendingRon": 17413636.99,
      "personnelSpendingRon": 2411582.88,
      "capitalSpendingRon": 2791914.67,
      "developmentSpendingRon": 0,
      "arrearsRon": null,
      "ownRevenueShare": 0.2942,
      "personnelSpendingShare": 0.1385,
      "capitalSpendingShare": 0.1603,
      "developmentSpendingShare": 0.0,
      "revenuePerInhabitantRon": 5182.97,
      "ownRevenuePerInhabitantRon": 1524.91,
      "spendingPerInhabitantRon": 5265.69,
      "sourceLineCounts": {
        "revenue": 43,
        "spending": 161,
        "development": 0
      }
    },
    {
      "year": 2023,
      "siruta": "2309",
      "cui": "4562230",
      "level": "commune",
      "sampleRole": "rural-commune",
      "name": "ALMAŞU MARE",
      "transparentaName": "COMUNA ALMASU MARE",
      "countyCode": "AB",
      "population": 1175,
      "populationSource": "ins-tempo-pop107d-locality",
      "revenueRon": 3978959.56,
      "ownRevenueRon": 770532.74,
      "transferRevenueRon": 3208426.82,
      "spendingRon": 4010380.64,
      "personnelSpendingRon": 1916373.0,
      "capitalSpendingRon": 98875.18,
      "developmentSpendingRon": 0,
      "arrearsRon": null,
      "ownRevenueShare": 0.1937,
      "personnelSpendingShare": 0.4779,
      "capitalSpendingShare": 0.0247,
      "developmentSpendingShare": 0.0,
      "revenuePerInhabitantRon": 3386.35,
      "ownRevenuePerInhabitantRon": 655.77,
      "spendingPerInhabitantRon": 3413.09,
      "sourceLineCounts": {
        "revenue": 25,
        "spending": 80,
        "development": 0
      }
    },
    {
      "year": 2023,
      "siruta": "96478",
      "cui": "4541220",
      "level": "commune",
      "sampleRole": "rural-commune",
      "name": "COTNARI",
      "transparentaName": "COMUNA COTNARI",
      "countyCode": "IS",
      "population": 7209,
      "populationSource": "ins-tempo-pop107d-locality",
      "revenueRon": 18737493.38,
      "ownRevenueRon": 2268273.91,
      "transferRevenueRon": 16469219.47,
      "spendingRon": 17947967.93,
      "personnelSpendingRon": 6241726.0,
      "capitalSpendingRon": 2598216.96,
      "developmentSpendingRon": 0,
      "arrearsRon": null,
      "ownRevenueShare": 0.1211,
      "personnelSpendingShare": 0.3478,
      "capitalSpendingShare": 0.1448,
      "developmentSpendingShare": 0.0,
      "revenuePerInhabitantRon": 2599.18,
      "ownRevenuePerInhabitantRon": 314.64,
      "spendingPerInhabitantRon": 2489.66,
      "sourceLineCounts": {
        "revenue": 42,
        "spending": 118,
        "development": 0
      }
    },
    {
      "year": 2023,
      "siruta": "97090",
      "cui": "4540577",
      "level": "commune",
      "sampleRole": "rural-commune",
      "name": "GOLĂIEŞTI",
      "transparentaName": "COMUNA GOLAIESTI",
      "countyCode": "IS",
      "population": 3911,
      "populationSource": "ins-tempo-pop107d-locality",
      "revenueRon": 18533197.85,
      "ownRevenueRon": 984396.52,
      "transferRevenueRon": 17548801.33,
      "spendingRon": 16944074.15,
      "personnelSpendingRon": 2977061.0,
      "capitalSpendingRon": 10287348.07,
      "developmentSpendingRon": 0,
      "arrearsRon": null,
      "ownRevenueShare": 0.0531,
      "personnelSpendingShare": 0.1757,
      "capitalSpendingShare": 0.6071,
      "developmentSpendingShare": 0.0,
      "revenuePerInhabitantRon": 4738.74,
      "ownRevenuePerInhabitantRon": 251.7,
      "spendingPerInhabitantRon": 4332.41,
      "sourceLineCounts": {
        "revenue": 35,
        "spending": 65,
        "development": 0
      }
    },
    {
      "year": 2023,
      "siruta": "100004",
      "cui": "4540305",
      "level": "commune",
      "sampleRole": "rural-commune",
      "name": "VICTORIA",
      "transparentaName": "COMUNA VICTORIA",
      "countyCode": "IS",
      "population": 4413,
      "populationSource": "ins-tempo-pop107d-locality",
      "revenueRon": 19064734.32,
      "ownRevenueRon": 4231821.66,
      "transferRevenueRon": 14832912.66,
      "spendingRon": 22214529.15,
      "personnelSpendingRon": 2916894.0,
      "capitalSpendingRon": 5212695.76,
      "developmentSpendingRon": 0,
      "arrearsRon": null,
      "ownRevenueShare": 0.222,
      "personnelSpendingShare": 0.1313,
      "capitalSpendingShare": 0.2347,
      "developmentSpendingShare": 0.0,
      "revenuePerInhabitantRon": 4320.13,
      "ownRevenuePerInhabitantRon": 958.94,
      "spendingPerInhabitantRon": 5033.88,
      "sourceLineCounts": {
        "revenue": 45,
        "spending": 74,
        "development": 0
      }
    },
    {
      "year": 2023,
      "siruta": "127144",
      "cui": "4394560",
      "level": "commune",
      "sampleRole": "rural-commune",
      "name": "GOSTAVĂŢU",
      "transparentaName": "COMUNA GOSTAVATU",
      "countyCode": "OT",
      "population": 2563,
      "populationSource": "ins-tempo-pop107d-locality",
      "revenueRon": 5651163.96,
      "ownRevenueRon": 937832.73,
      "transferRevenueRon": 4713331.23,
      "spendingRon": 5559562.84,